Date,Article title,link,publisher,Article sentiment
None,"McDonald’s, Apple and Tesla can’t bet on making a fortune in China anymore",https://finance.yahoo.com/m/141e93ad-ddb1-3287-a8e6-368b90290b63/mcdonald%E2%80%99s%2C-apple-and-tesla.html,CNN Business,neutral
None,Is the Apple Vision Pro Headset Worth the Price?,https://finance.yahoo.com/m/83e94fbe-8429-36b8-a1bb-81fc268993cc/is-the-apple-vision-pro.html,Motley Fool,neutral
None,What Warren Buffett Is Selling and Saying,https://finance.yahoo.com/m/2ebdb434-9081-370b-9d3f-0b5b5dd08c14/what-warren-buffett-is.html,Motley Fool,neutral
None,"Meme trade roars back to life, OpenAI's GPT-4o: Market Domination",https://finance.yahoo.com/video/meme-trade-roars-back-life-215638232.html,Yahoo Finance Video,neutral
2024-05-13T21:40:29.000Z,,,,Nan too long
None,iPad Pro vs. MacBook: The Great Apple Laptop Trade-Off,https://finance.yahoo.com/m/2894d96f-6fe5-3b01-a64c-b1096dca1c7c/ipad-pro-vs.-macbook%3A-the.html,The Wall Street Journal,neutral
2024-05-13T20:48:42.000Z,Apple Reportedly Close To Deal With OpenAI To Add AI Features To iPhone,https://finance.yahoo.com/m/5134693b-177f-3676-a745-a6c437241cc7/apple-reportedly-close-to.html,Investor's Business Daily,negative
2024-05-13T20:47:44.000Z,,,,Nan too long
