Date,Article title,link,publisher,Article sentiment
None,Is GE Aerospace Stock Going to $185? 1 Wall Street Analyst Thinks So.,https://finance.yahoo.com/m/431afbdc-b95a-3d87-bcc4-830c8ebaefd1/is-ge-aerospace-stock-going.html,Motley Fool,neutral
None,"GE Aerospace Stock Has 17% Upside, According to 1 Wall Street Analyst",https://finance.yahoo.com/m/c1f49104-cd1d-3355-8bcf-4039d25a829f/ge-aerospace-stock-has-17%25.html,Motley Fool,neutral
None,Why GE HealthCare Technologies Stock Just Crashed 14%,https://finance.yahoo.com/m/d39db294-02fc-3853-8c06-7f3f29fed430/why-ge-healthcare.html,Motley Fool,neutral
None,GE Aerospace Is the S&P 500’s Top-Performing Stock in April. Globe Life Is the Worst.,https://finance.yahoo.com/m/2ad097e5-03d7-3aa8-a49e-5b0b9c1659f4/ge-aerospace-is-the-s%26p-500%E2%80%99s.html,Barrons.com,neutral
None,GE Vernova Doing Fine As It Toddles Away From Former Parent GE,https://finance.yahoo.com/m/d6968851-c3fe-39f8-96bb-f221dd00e8d1/ge-vernova-doing-fine-as-it.html,Investor's Business Daily,neutral
None,How GE Created $200 Billion in Market Value by Breaking Into Pieces,https://finance.yahoo.com/m/99d76bbb-1a13-3b1e-909b-65c53724449a/how-ge-created-%24200-billion.html,Barrons.com,neutral
None,Is It Too Late to Buy GE Aerospace Stock?,https://finance.yahoo.com/m/8de851d9-123a-3e96-b0ce-10a845969995/is-it-too-late-to-buy-ge.html,Motley Fool,neutral
2024-04-27T12:00:00.000Z,,,,Nan too long
