Date,Article title,link,publisher,Article sentiment
None,"Tesla Stock Is Still A Big Loser In 2024, But It's Far More Expensive",https://finance.yahoo.com/m/6329c605-2be6-3c0f-9499-0f2aada785aa/tesla-stock-is-still-a-big.html,Investor's Business Daily,neutral
None,Elon Musk Touts Tesla FSD Amid EV Woes; BYD Breaks Out As Margins Soar,https://finance.yahoo.com/m/29c92e28-b5ab-392e-8f22-ae525864f9e8/elon-musk-touts-tesla-fsd.html,Investor's Business Daily,neutral
None,Elon Musk Says You Shouldn't Invest in Tesla Stock Unless You Believe This 1 Thing About the Future,https://finance.yahoo.com/m/94408ec6-37f1-341a-bfc4-6a73f7ed5f8a/elon-musk-says-you-shouldn%27t.html,Motley Fool,neutral
None,Where Will Nikola Stock Be in 5 Years?,https://finance.yahoo.com/m/a8f6ab69-d12f-3dc1-bcc4-8061ea2599c2/where-will-nikola-stock-be-in.html,Motley Fool,neutral
2024-05-04T01:00:00.000Z,Elon Musk Tries to Make Himself Indispensable at Tesla Ahead of Pay Vote,https://finance.yahoo.com/m/1aa931e1-d313-3087-814b-0cbea119be6b/elon-musk-tries-to-make.html,The Wall Street Journal,negative
2024-05-04T00:41:50.000Z,,,,Nan too long
None,The Big Threat Hanging Over Google,https://finance.yahoo.com/m/d2afdac1-3589-3cf8-a87f-8ad67325d990/the-big-threat-hanging-over.html,The Information,neutral
2024-05-03T21:56:00.000Z,,,,Nan too long
